{"component_key":"ui.my-requests","component_version":"2.2.0","contributions":[{"bindings":{"empty_state":{"context":"tsx_text","source":"input.empty_state"},"heading":{"context":"tsx_text","source":"input.heading"}},"operation":"render_template","slot":"frontend/features/my-requests","source":"templates/MyRequests.tsx","target":"MyRequests.tsx"}],"schema_version":"factory-component-adapter/v1"}
