{"schema_version":"factory-component-adapter/v1","component_key":"ui.approval-form","component_version":"1.0.0","contributions":[{"operation":"render_template","source":"templates/ApprovalForm.tsx","slot":"frontend/features/approval-form","target":"ApprovalForm.tsx","bindings":{"record_label":{"source":"input.record_label","context":"tsx_text"},"submit_label":{"source":"input.submit_label","context":"tsx_text"},"fields":{"source":"input.fields","context":"json_value"}}}]}
