{"schema_version":"factory-component-adapter/v1","component_key":"ui.approval-queue","component_version":"1.0.0","contributions":[{"operation":"render_template","source":"templates/ApprovalQueue.tsx","slot":"frontend/features/approval-queue","target":"ApprovalQueue.tsx","bindings":{"heading":{"source":"input.heading","context":"tsx_text"},"approve_label":{"source":"input.approve_label","context":"tsx_text"},"reject_label":{"source":"input.reject_label","context":"tsx_text"}}}]}
