{"component_key":"ui.app-shell","component_version":"2.1.0","contributions":[{"bindings":{},"operation":"render_template","slot":"frontend/app-shell","source":"templates/factory-ui.css","target":"factory-ui.css"},{"bindings":{},"operation":"render_template","slot":"frontend/app-shell","source":"templates/tokens.css","target":"tokens.css"},{"bindings":{"navigation":{"context":"json_value","source":"input.navigation"},"product_name":{"context":"tsx_text","source":"input.product_name"}},"operation":"render_template","slot":"frontend/app-shell","source":"templates/ApplicationShell.tsx","target":"ApplicationShell.tsx"},{"bindings":{"audit_heading":{"context":"tsx_text","source":"input.audit_heading"}},"operation":"render_template","slot":"frontend/features/audit","source":"templates/AuditLog.tsx","target":"AuditLog.tsx"}],"schema_version":"factory-component-adapter/v1"}
