{"schema_version":"factory-component-adapter/v1","component_key":"ui.profile-page","component_version":"2.0.0","contributions":[{"operation":"render_template","source":"templates/ProfilePage.tsx","slot":"frontend/routes/profile","target":"ProfilePage.tsx","bindings":{"heading":{"source":"input.heading","context":"tsx_text"},"editable_fields":{"source":"input.editable_fields","context":"json_value"}}}]}
