{"schema_version":"factory-component-adapter/v1","component_key":"backend.rbac","component_version":"1.0.0","contributions":[{"operation":"render_template","source":"templates/rbac.py.tmpl","slot":"backend/authz","target":"rbac.py","bindings":{"policy_name":{"source":"input.policy_name","context":"python_string"}}}]}
