{"component_key":"ui.approval-form","component_version":"2.2.0","contributions":[{"bindings":{"fields":{"context":"json_value","source":"input.fields"},"record_label":{"context":"tsx_text","source":"input.record_label"},"submit_label":{"context":"tsx_text","source":"input.submit_label"}},"operation":"render_template","slot":"frontend/features/approval-form","source":"templates/ApprovalForm.tsx","target":"ApprovalForm.tsx"}],"schema_version":"factory-component-adapter/v1"}
