{"component_key":"ui.profile-page","component_version":"2.4.0","contributions":[{"bindings":{"editable_fields":{"context":"json_value","source":"input.editable_fields"},"heading":{"context":"tsx_text","source":"input.heading"}},"operation":"render_template","slot":"frontend/routes/profile","source":"templates/ProfilePage.tsx","target":"ProfilePage.tsx"}],"schema_version":"factory-component-adapter/v1"}
