{"component_key":"ui.approval-queue","component_version":"2.4.0","contributions":[{"bindings":{"approve_label":{"context":"tsx_text","source":"input.approve_label"},"heading":{"context":"tsx_text","source":"input.heading"},"reject_label":{"context":"tsx_text","source":"input.reject_label"}},"operation":"render_template","slot":"frontend/features/approval-queue","source":"templates/ApprovalQueue.tsx","target":"ApprovalQueue.tsx"}],"schema_version":"factory-component-adapter/v1"}
