{"component_key":"ui.system-settings-page","component_version":"2.1.0","contributions":[{"bindings":{"heading":{"context":"tsx_text","source":"input.heading"},"settings":{"context":"json_value","source":"input.settings"}},"operation":"render_template","slot":"frontend/routes/system-settings","source":"templates/SystemSettingsPage.tsx","target":"SystemSettingsPage.tsx"}],"schema_version":"factory-component-adapter/v1"}
