{"schema_version":"factory-component-adapter/v1","component_key":"backend.record-api","component_version":"1.0.0","contributions":[{"operation":"render_template","source":"templates/record_api.py.tmpl","slot":"backend/api/records","target":"record_api.py","bindings":{"record_label":{"source":"input.record_label","context":"python_string"},"record_path":{"source":"input.record_path","context":"python_string"},"record_table":{"source":"input.record_table","context":"python_string"},"submitter_role":{"source":"input.submitter_role","context":"python_string"}}},{"operation":"render_template","source":"templates/record_schema.sql.tmpl","slot":"data/record-schema","target":"records.sql","bindings":{"record_table":{"source":"input.record_table","context":"python_string"}}}]}
