{"schema_version":"factory-component-adapter/v1","component_key":"ui.app-shell","component_version":"2.0.0","contributions":[{"operation":"render_template","source":"templates/ApplicationShell.tsx","slot":"frontend/app-shell","target":"ApplicationShell.tsx","bindings":{"product_name":{"source":"input.product_name","context":"tsx_text"},"navigation":{"source":"input.navigation","context":"json_value"}}},{"operation":"render_template","source":"templates/AuditLog.tsx","slot":"frontend/features/audit","target":"AuditLog.tsx","bindings":{"audit_heading":{"source":"input.audit_heading","context":"tsx_text"}}}]}
