{"schema_version":"factory-component-adapter/v1","component_key":"ui.login-page","component_version":"2.0.0","contributions":[{"operation":"render_template","source":"templates/LoginPage.tsx","slot":"frontend/routes/login","target":"LoginPage.tsx","bindings":{"product_name":{"source":"input.product_name","context":"tsx_text"},"sign_in_label":{"source":"input.sign_in_label","context":"tsx_text"}}}]}
