{"schema_version":"factory-component-adapter/v1","component_key":"backend.session-auth","component_version":"1.0.0","contributions":[{"operation":"render_template","source":"templates/session_auth.py.tmpl","slot":"backend/auth","target":"session_auth.py","bindings":{"allowed_roles":{"source":"input.allowed_roles","context":"json_value"},"cookie_name":{"source":"input.cookie_name","context":"python_string"},"local_users_env":{"source":"input.local_users_env","context":"python_string"},"signing_key_env":{"source":"input.signing_key_env","context":"python_string"},"session_ttl_seconds":{"source":"input.session_ttl_seconds","context":"json_value"}}}]}
