{"schema_version":"factory-component-adapter/v1","component_key":"ui.system-settings-page","component_version":"1.0.0","contributions":[{"operation":"render_template","source":"templates/SystemSettingsPage.tsx","slot":"frontend/routes/system-settings","target":"SystemSettingsPage.tsx","bindings":{"heading":{"source":"input.heading","context":"tsx_text"},"settings":{"source":"input.settings","context":"json_value"}}}]}
